{
  "schemaVersion": "sacs-v06-phase-report/1.0",
  "phaseId": "S00",
  "status": "PASS",
  "sourceSha": "0cce422873f69df1ea7b78f72067dcd48e3c6b51",
  "startedAt": "2026-09-06T06:27:13.385Z",
  "completedAt": "2026-09-06T06:27:40.054Z",
  "commands": [
    {
      "command": "python3 config/v0.6/task-package/scripts/verify_task_package.py",
      "exitCode": 0,
      "sourceBefore": "0cce422873f69df1ea7b78f72067dcd48e3c6b51",
      "sourceAfter": "0cce422873f69df1ea7b78f72067dcd48e3c6b51",
      "outputDigest": "sha256:9b6b78b1f91838356318ad3d67b717eba1e7da5d8e2dd3f9c18f5a415ec6311e"
    },
    {
      "command": "pnpm typecheck",
      "exitCode": 0,
      "sourceBefore": "0cce422873f69df1ea7b78f72067dcd48e3c6b51",
      "sourceAfter": "0cce422873f69df1ea7b78f72067dcd48e3c6b51",
      "outputDigest": "sha256:e3b0c44298fc1c149afbf4c8996fb92427ae41e4649b934ca495991b7852b855"
    },
    {
      "command": "pnpm test:v05:focused",
      "exitCode": 0,
      "sourceBefore": "0cce422873f69df1ea7b78f72067dcd48e3c6b51",
      "sourceAfter": "0cce422873f69df1ea7b78f72067dcd48e3c6b51",
      "outputDigest": "sha256:e3b0c44298fc1c149afbf4c8996fb92427ae41e4649b934ca495991b7852b855"
    },
    {
      "command": "node scripts/verify-migrations.mjs",
      "exitCode": 0,
      "sourceBefore": "0cce422873f69df1ea7b78f72067dcd48e3c6b51",
      "sourceAfter": "0cce422873f69df1ea7b78f72067dcd48e3c6b51",
      "outputDigest": "sha256:2903fe7b7ba1c21854549613e7afe6763cc2e2409dc607346955849ffddf12ff"
    },
    {
      "command": "node scripts/verify-v05-architecture.mjs",
      "exitCode": 0,
      "sourceBefore": "0cce422873f69df1ea7b78f72067dcd48e3c6b51",
      "sourceAfter": "0cce422873f69df1ea7b78f72067dcd48e3c6b51",
      "outputDigest": "sha256:db96e2da0309f5e8bec10e8371c0387aaef14aa63ad9453a49ac24fdd5053e24"
    }
  ],
  "acceptanceIds": [
    "V06-S00-001",
    "V06-S00-002",
    "V06-S00-003",
    "V06-S00-004",
    "V06-S00-005",
    "V06-S00-006",
    "V06-S00-007",
    "V06-S00-008",
    "V06-S00-009",
    "V06-S00-010"
  ],
  "blockers": [],
  "notes": [
    "S00 source inventory and immutable artifact intake reviewed; all 135 ledger rows initialized before S00 promotion."
  ]
}
